[
  {
    "id": "metric-opencode-minimax-kotlin-bazel-proof-states",
    "schema_version": "0.1.0",
    "metric_name": "observed_required_proof_state_count",
    "dimensions": {
      "repository": "sdp-trace",
      "scope": "opencode-minimax-kotlin-bazel",
      "model_family": "MiniMax",
      "harness": "OpenCode",
      "stack": "Kotlin",
      "build_system": "Bazel"
    },
    "samples": [
      {
        "id": "sample-opencode-minimax-kotlin-bazel-observed-proof-states",
        "value": 8,
        "unit": "count",
        "window_start": "2026-05-01T14:28:53Z",
        "window_end": "2026-05-01T14:28:53Z",
        "dimensions": {
          "repository": "sdp-trace",
          "scope": "opencode-minimax-kotlin-bazel"
        },
        "evidence_refs": [
          "evidence-opencode-available",
          "evidence-minimax-model-listed",
          "evidence-minimax-access-verified",
          "evidence-kotlin-bazel-target-identified",
          "evidence-opencode-minimax-run-completed",
          "evidence-bazel-commands-executed",
          "evidence-sdp-trace-package-valid",
          "evidence-sanitized-report-committed"
        ],
        "provenance_refs": [
          "provenance-opencode-minimax-kotlin-bazel-run"
        ],
        "assessment_state": "assessed"
      }
    ],
    "comparisons": [],
    "assessment_state": "assessed",
    "created_at": "2026-05-01T14:28:53Z",
    "updated_at": "2026-05-01T14:28:53Z"
  }
]
